"29","2A88SUW5","journalArticle",2019,"Fitzpatrick, J. F.; Hicks, K. M.; Russell, M.; Hayes, P. R.","The Reliability of Potential Fatigue-Monitoring Measures in Elite Youth Soccer Players","Journal of strength and conditioning research",NA,"1533-4287","10.1519/JSC.0000000000003317",NA,"Fitzpatrick, JF, Hicks, KM, Russell, M, and Hayes, PR. The reliability of potential fatigue-monitoring measures in elite youth soccer players. J Strength Cond Res XX(X): 000-000, 2019-Monitoring fatigue is of vital importance to practitioners; however, logistics and concerns about reliability may impede the use of certain measures. This study aimed to quantify the reliability of potential measures of fatigue; a subjective wellness questionnaire, jump performance tests, and tri-axial accelerometer variables derived during submaximal shuttle running in elite youth soccer players. A secondary aim was to establish the minimum test duration that could be used for the submaximal shuttle run while maintaining good reliability. Seventeen male youth team players (age: 17.4 ± 0.5 years) were assessed on 2 occasions, spaced 7 days apart. Typical error, coefficient of variation (CV%), interclass correlation (ICC), and minimum detectable change were calculated for a subjective wellness questionnaire, countermovement jump (CMJ), squat jump (SJ) and drop jump contact time (DJ-CT), drop jump height (DJ-JH), and reactive strength (DJ-RSI). A novel submaximal shuttle running test was also used to assess tri-axial accelerometer data reliability. Results suggest that CMJ, SJ, DJ-CT, and DJ-RSI have good test-retest reliability (CV% = 4.5-7.7; ICC = 0.80-0.88); however DJ-JH did not show acceptable reliability (CV% = 6.0; ICC = 0.76). Good reliability was found for all tri-axial accelerometer variables during a 3-minute (2-minute analysis) submaximal shuttle run (CV% = 2.4-8.0; ICC = 0.81-0.95), except for % PlayerLoad anterior-posterior (%PLAP) (CV% = 7.2; ICC = 0.63). The subjective wellness questionnaire demonstrated poor reliability for all items (CV% = 11.2-30.0; ICC = 0.00-0.78). The findings from this study provide practitioners with valuable information about the reliability of a range of potential fatigue-monitoring measures. This can be used to help make accurate decisions about the magnitude of change in these assessments when used in practice.","2019","2020-05-20 00:41:22","2020-05-20 00:41:22",NA,"",NA,"","",NA,NA,NA,NA,NA,NA,NA,NA,NA,"English",NA,NA,NA,NA,"Medline",NA,NA,NA,"; ","http://dx.doi.org/10.1519/JSC.0000000000003317; http://www.embase.com/search/results?subaction=viewrecord&from=export&id=L629262852","human; male; article; soccer player; controlled study; accelerometer; performance; adolescent; running; questionnaire; juvenile; fatigue; physician; minimum detectable change; contact time; quantitative analysis; test retest reliability",NA,NA,NA,NA,NA,NA,NA,NA,NA,NA,NA,NA,NA,NA,NA,NA,NA,NA,NA,NA,NA,NA,NA,NA,NA,NA,NA,NA,NA,NA,NA,NA,NA,NA,NA,NA,NA,NA,NA,NA,NA,NA,NA,NA,NA,NA,NA,0
"30","4SM4NGR3","journalArticle",2019,"Manuel Clemente, F.; Theodoros Nikolaidis, P.; Rosemann, T.; Knechtle, B.","Variations of internal and external load variables between intermittent small-sided soccer game training regimens","International Journal of Environmental Research and Public Health",NA,"1660-4601 1661-7827","10.3390/ijerph16162923",NA,"The purpose of this study was twofold: (i) analyze the variations of internal and external load between intermittent regimens (6 × 3’ and 3 × 6’) during a small-sided game (SSG); and (ii) analyze the variations of internal and external load within-intermittent regimens (between sets). Ten male amateur soccer players (age: 21.7 ± 2.1 years) participated in this study. Almost certain large decreases in total distance (−8.6%, −12.3; −4.8, Effect Size (ES): −1.51, −2.20; −0.82) and running distance (−34.0%, 47.0; −17.8, ES: −2.23, −3.40; −1.05) were observed when comparing the 3 × 6’ and 6 × 3’. Very likely moderate and large decreases in total accelerations (−24.0%, −35.1; −10.9; ES: −1.11, −1.75; −0.47) and total of decelerations (−26.7%, −38.8; −12.1; ES:−1.49, −2.36; −0.62), respectively, were found when comparing the 3 × 6’ and 6 × 3’. Very likely increases in rated of perceived exertion in the set 3 in comparison to the 1st during the 3 × 6’ SSG (34.5%, 12.4; 61.0, ES: 1.35, 0.53; 2.16) and the 6 × 3’ (29.9%, 11.6; 51.2; ES: 1.17, 0.49; 1.85). Longer sets increase the perception of effort and contribute to a large decrease in total and running distances, and total of accelerations and decelerations. Meaningful decreases in time-motion demands occur between sets 2 and 3 while perceived effort increases.","2019","2020-05-20 00:57:23","2020-05-20 00:57:23",NA,"",NA,"16","16",NA,NA,NA,NA,NA,NA,NA,NA,NA,"English",NA,NA,NA,NA,"Embase Medline",NA,NA,NA,"; ","http://dx.doi.org/10.3390/ijerph16162923; http://www.embase.com/search/results?subaction=viewrecord&from=export&id=L2002471117","adult; human; human experiment; male; article; football; soccer player; exercise; young adult; deceleration; running; motion; perception; effect size",NA,NA,NA,NA,NA,NA,NA,NA,NA,NA,NA,NA,NA,NA,NA,NA,NA,NA,NA,NA,NA,NA,NA,NA,NA,NA,NA,NA,NA,NA,NA,NA,NA,NA,NA,NA,NA,NA,NA,NA,NA,NA,NA,NA,NA,NA,NA,0
"31","54VKGH85","journalArticle",2019,"Wang, C.","The effect of electrolyte in the body on the athlete's body in football match","Basic and Clinical Pharmacology and Toxicology",NA,"1742-7843","10.1111/bcpt.13266",NA,"Objectives: Electrolytes play a very important role in the maintenance of normal life activities. The movement body supplements the relative balance of electrolyte sodium and potassium ions, maintains the complete function and structure of the whole cell, summarizes the relationship between the electrolyte and the motor ability, and provides the theoretical basis for the athlete to replenish the electrolyte. Methods: In a fierce football game, the distance the athlete runs is about 9000 meters-15000 meters, the overall energy consumption is about 2000 calories, the weight loss is about 3∼4 kg or so. Causes the electrolyte in the body to be lost in large quantities with sweat. Causing the imbalance of electrolyte balance, muscle excitability and muscle spasm in vivo, dehydration, especially the cardiovascular system, the physiological function of the nervous system and the body's material metabolism of the corresponding obstacles, if the amount of body fluids is lost too much, there will be shock symptoms. Serious can often lead to death. The balance of water and electrolytes is regulated by the nervous system and certain hormones, which are mainly achieved through the effects of nerves, especially some hormones, on the treatment of water and electrolytes in the kidneys. Results: The change of body function in football matches will directly affect the technical and tactical performance of athletes in the match. Conclusions: To keep the electrolyte constant in the body, the human body should replenish the electrolyte properly in the game. Maintain body blood solvent balance, help nerve transport, regulate muscle contraction, and maintain acid-base balance.","2019","2020-05-20 00:16:20","2020-05-20 00:16:20",NA,"51-52",NA,"","125",NA,NA,NA,NA,NA,NA,NA,NA,NA,"English",NA,NA,NA,NA,"Embase",NA,NA,NA,"; ","http://dx.doi.org/10.1111/bcpt.13266; http://www.embase.com/search/results?subaction=viewrecord&from=export&id=L628906542","conference abstract; human; football; controlled study; athlete; energy consumption; electrolyte; sweat; body weight loss; dehydration; water; death; nervous system; calorie; acid base balance; cardiovascular system; electrolyte balance; excitability; hormone; in vivo study; kidney; muscle spasm; nervous system function; solvent",NA,NA,NA,NA,NA,NA,NA,NA,NA,NA,NA,NA,NA,NA,NA,NA,NA,NA,NA,NA,NA,NA,NA,NA,NA,NA,NA,NA,NA,NA,NA,NA,NA,NA,NA,NA,NA,NA,NA,NA,NA,NA,NA,NA,NA,NA,NA,0
"32","XS5G8ZEE","journalArticle",2019,"Cecchi, Nicholas J.; Oros, Theophil J.; Ringhofer, Justin J.; Monroe, Derek C.","Comparison of head impact attenuation capabilities between a standard American football helmet and novel protective equipment that couples a helmet and shoulder pads","Sports Engineering (Springer Science & Business Media B.V.)",NA,"13697072","",NA,"Concussive and subconcussive sports-related head impacts are common in the United States, particularly in American football. Football helmets are constantly improving upon their predecessors and are proven to reduce head impact kinematics and the risk of sports-related head injury. All football helmets are required to pass certification testing overseen by the National Operating Committee on Standards for Athletic Equipment (NOCSAE) before they are permitted for use. A new advance in protective equipment involves coupling a helmet and shoulder pads as one connected piece of protective equipment. These protective gears cannot be tested using the standard NOCSAE method as they are worn over a user's head, neck, and upper torso. We aimed to test the effectiveness of a prototype of a coupled, one-piece design, relative to a standard football helmet, using a custom drop tower method of testing. Relative to the standard football helmet, the coupled design reduced measures of peak linear acceleration at front, side, and rear impacts (p <.001) and peak rotational acceleration at all tested head locations (p <.004). The coupled design was also more effective than the standard helmet in attenuating the resultant upper neck force (p <.004) at all tested head impact locations and resultant upper neck moment at rear and side impact locations (p <.048). Future iterations of coupled, one-piece designs should use the results of this study to make improvements to the device, and further investigations on the effectiveness and safety implications of the protective gear are necessary. ABSTRACT FROM AUTHOR","2019","2020-05-20 00:11:51","2020-05-20 00:11:51",NA,"N.PAG-N.PAG",NA,"3/4","22",NA,NA,NA,NA,NA,NA,NA,NA,NA,"",NA,NA,NA,NA,"sph",NA,NA,NA,"","https://gateway.library.qut.edu.au/login?url=https://search.ebscohost.com/login.aspx?direct=true&db=sph&AN=138724177&site=ehost-live&scope=site","*FOOTBALL; UNITED States; Concussion; *ATHLETIC equipment; *FOOTBALL helmets; *HELMETS; *SAFETY hats; *SHOULDER; Head kinematics; Headgear; Helmet; LINEAR acceleration; Neck injury",NA,NA,NA,NA,NA,NA,NA,NA,NA,NA,NA,NA,NA,NA,NA,NA,NA,NA,NA,NA,NA,NA,NA,NA,NA,NA,NA,NA,NA,NA,NA,NA,NA,NA,NA,NA,NA,NA,NA,NA,NA,NA,NA,NA,NA,NA,NA,0
"33","VYBEAPHT","journalArticle",2019,"Watson, D.; Brickson, S.","Acute decreases in sleep duration predict in-season injuries in female youth soccer players: A 2-year prospective study","Pediatrics",NA,"1098-4275","10.1542/peds.144.2-MeetingAbstract.192",NA,"Purpose: Prior efforts to evaluate the effect of sleep on injury risk have been retrospective and failed to account for the potential confounding effects of training load. Therefore, the purpose of this study was to determine whether sleep duration is an independent predictor of in-season injury in female youth soccer players. Methods: Adolescent female soccer players (13-18 years) from a single club were monitored for 2 years of formal competition (96 weeks). Participants recorded prior night sleep duration every morning, training load (session-rating of perceived exertion), and time-loss injuries throughout the study period. Data were aggregated weekly and 2, 3, and 4 week rolling averages were calculated as well as an acute:chronic ratio (A:C; weekly divided by 4 week) for both sleep and training load. Separate multivariable Poisson regression models were used to predict the number of weekly injuries throughout the study period using 1, 2, 3, and 4 week sleep averages and A:C sleep ratio from the preceding week, while adjusting for training load over the same time frame as a covariate. Results: 97 injuries were recorded during the study period. Average sleep during the study period was 7.93 ± 0.7 hours. After controlling for training load, weekly injuries were not significantly predicted by the preceding 1 week (OR=1.10 [0.51-2.3], p=0.81), 2 week (OR=1.05 [0.41-2.6], p=0.91), 3 week (OR=1.30 [0.41-4.0], p=0.65), or 4 week (OR=1.51 [0.40-5.6], p=0.54) sleep duration. However, decreased A:C sleep ratio was a significant predictor of increased injury the following week (OR=0.77 [0.59-0.98], p=0.043). Conclusion: After controlling for training load, decreased weekly sleep duration relative to the prior month is a significant, independent predictor of increased injuries the following week. This suggests that relative sleep restriction may offer a more sensitive predictor of injury risk than acute or chronic sleep duration alone. Monitoring of sleep duration may allow for individualized intervention to reduce the risk of injuries in adolescent female athletes.","2019","2020-05-20 00:07:20","2020-05-20 00:07:20",NA,"",NA,"2","144",NA,NA,NA,NA,NA,NA,NA,NA,NA,"English",NA,NA,NA,NA,"Embase",NA,NA,NA,"; ","http://dx.doi.org/10.1542/peds.144.2-MeetingAbstract.192; http://www.embase.com/search/results?subaction=viewrecord&from=export&id=L630632264","adult; conference abstract; female; human; soccer player; injury; exercise; controlled study; major clinical study; prospective study; season; competition; adolescent; juvenile; night sleep; sleep time",NA,NA,NA,NA,NA,NA,NA,NA,NA,NA,NA,NA,NA,NA,NA,NA,NA,NA,NA,NA,NA,NA,NA,NA,NA,NA,NA,NA,NA,NA,NA,NA,NA,NA,NA,NA,NA,NA,NA,NA,NA,NA,NA,NA,NA,NA,NA,0
"34","Z2WAHPC6","journalArticle",2019,"DiCesare, C. A.; Montalvo, A.; Foss, K. D. B.; Thomas, S. M.; Hewett, T. E.; Jayanthi, N. A.; Myer, G. D.","Sport Specialization and Coordination Differences in Multisport Adolescent Female Basketball, Soccer, and Volleyball Athletes","Journal of athletic training",NA,"1938-162X","10.4085/1062-6050-407-18",NA,"CONTEXT: Early sport specialization, or the participation in 1 sport year-round to the exclusion of all others, is a growing concern in youth athletics because of its possible association with musculoskeletal injury. The underlying injury risk may be the result of coordination differences that sport-specialized athletes have been speculated to exhibit relative to multisport athletes; however, little evidence exists to support or refute this notion. OBJECTIVE: To examine relative hip- and knee-joint angular-motion variability among adolescent sport-specialized and multisport female adolescent athletes to determine how sport specialization may affect coordination. DESIGN: Cohort study. SETTING: Research laboratory. PATIENTS OR OTHER PARTICIPANTS: A total of 366 sport-specialized and 366 multisport adolescent female basketball, soccer, and volleyball players. INTERVENTION(S): Drop-vertical-jump (DVJ) assessment. MAIN OUTCOME MEASURE(S): Average coupling-angle variability (CAV) for hip flexion and knee flexion, knee flexion and ankle flexion, hip flexion and knee abduction, knee flexion and knee abduction, knee flexion and knee internal rotation, and knee abduction and knee internal rotation. RESULTS: The sport-specialized group exhibited increased coupling variability in dominant-limb hip flexion and knee flexion (P = .015), knee flexion and knee abduction (P = .014), and knee flexion and knee internal rotation (P = .048) while landing during the DVJ, although they had small effect sizes (η2 = 0.010, 0.010, and 0.007, respectively). No differences were present between groups for any of the other CAV measures of the dominant limb, and no differences were found for any CAV measures of the nondominant limb (all P values > .05). CONCLUSIONS: Sport specialization was associated with increased variability of critical hip- and knee-joint couplings responsible for effective landing during the DVJ. Altered coordination strategies that involve the hip and knee joints may underlie unstable landings, inefficient force-absorption strategies, or greater contact forces that can place the lower extremities at risk for injury (or a combination of these).","2019","2020-05-20 00:46:17","2020-05-20 00:46:17",NA,"1105-1114",NA,"10","54",NA,NA,NA,NA,NA,NA,NA,NA,NA,"English",NA,NA,NA,NA,"Medline",NA,NA,NA,"; ","http://dx.doi.org/10.4085/1062-6050-407-18; http://www.embase.com/search/results?subaction=viewrecord&from=export&id=L629646363","female; human; article; soccer; hip; basketball; controlled study; major clinical study; adolescent; athlete; cohort analysis; outcome assessment; motor performance; athletics; volleyball; effect size; abduction; ankle; knee function; rotation; musculoskeletal injury; cumulative trauma disorder; youth sport; specialization",NA,NA,NA,NA,NA,NA,NA,NA,NA,NA,NA,NA,NA,NA,NA,NA,NA,NA,NA,NA,NA,NA,NA,NA,NA,NA,NA,NA,NA,NA,NA,NA,NA,NA,NA,NA,NA,NA,NA,NA,NA,NA,NA,NA,NA,NA,NA,0
"35","9RZPY9NM","journalArticle",2019,"Iwame, T.; Matsuura, T.; Suzue, N.; Iwase, J.; Uemura, H.; Sairyo, K.","Factors Associated With Knee Pain and Heel Pain in Youth Soccer Players Aged 8 to 12 Years","Orthopaedic Journal of Sports Medicine",NA,"2325-9671","10.1177/2325967119883370",NA,"Background: Soccer is played by many children younger than 12 years. Despite its health benefits, soccer has also been linked to a high number of sport-related injuries. Purpose: To investigate the relationship between clinical factors and knee or heel pain in youth soccer players. Study Design: Cross-sectional study; Level of evidence, 3. Methods: Study participants included 602 soccer players aged 8 to 12 years who were asked whether they had experienced episodes of knee or heel pain. Data were collected on age, body mass index, years of playing soccer, playing position, and training hours per week. Associations of clinical factors with the prevalence of knee or heel pain were examined by univariate and multivariate logistic regression analyses. Results: Episodes of knee and heel pain were reported by 29.4% and 31.1% of players, respectively. Multivariate analyses revealed that older age and more years of playing soccer were significantly and positively associated with the prevalence of knee pain (P =.037 and P =.015 for trend, respectively) but did not identify any significant associations for heel pain. Conclusion: In this study of youth soccer players, knee pain was associated with older age and more years of play, but heel pain was not significantly associated with any factor.","2019","2020-05-20 00:22:13","2020-05-20 00:22:13",NA,"",NA,"11","7",NA,NA,NA,NA,NA,NA,NA,NA,NA,"English",NA,NA,NA,NA,"Embase",NA,NA,NA,"; ","http://dx.doi.org/10.1177/2325967119883370; http://www.embase.com/search/results?subaction=viewrecord&from=export&id=L2003724089","human; male; article; soccer player; priority journal; controlled study; major clinical study; training; body mass; questionnaire; juvenile; cross-sectional study; child; school child; prevalence; knee pain; informed consent; heel pain; preschool child",NA,NA,NA,NA,NA,NA,NA,NA,NA,NA,NA,NA,NA,NA,NA,NA,NA,NA,NA,NA,NA,NA,NA,NA,NA,NA,NA,NA,NA,NA,NA,NA,NA,NA,NA,NA,NA,NA,NA,NA,NA,NA,NA,NA,NA,NA,NA,0
"36","BJGEJVXS","journalArticle",2019,"Fabok, Miloslav; Leontijević, Bojan; Tomić, Lazar; Dopsaj, Milivoj","NEUROMUSCULAR CHARACTERISTICS OF THE BICEPS FEMORIS MUSCLE IN THE TOP SERBIAN SOCCER PLAYERS MEASURED BY THE TENSIOMYOGRAPHY METHOD: A QUANTITATIVE MODEL. / NEUROMIŠIĆNE KARAKTERISTIKE BICEPS FEMORIS MIŠIĆA KOD VRHUNSKIH SRPSKIH FUDBALERA MERENE METODOM TENZIOMIOGRAFIJE: KVANTITATIVNI MODEL","Facta Universitatis: Series Physical Education & Sport",NA,"1451740X","",NA,"The main aim of this study was to define the quantitative neuromuscular characteristics of the Biceps Femoris muscle (BF) as the knee joint flexor, i.e. the major synergist of the caudal body in all specific movement tasks of a football player, measured by the tensiomyography (TMG) method. The secondary aim of the study was to compare all TMG-BF characteristics in relation to bilateral dimorphism, as well as to compare dominant and non-dominant legs. The research was conducted on a sample which included 54 professional players aged 23.0 ± 4.4 years; body height: 182.6 ± 15.1 cm; body mass: 81.2 ± 15.1 kg; BMI: 23.3 ± 1.2 kg/cm². TMG variables were measured on the muscles during a transition training phase (mid-season and end of the season). The results have shown that the average Tc - 32.19 ± 7.64 and 33.21 ± 8.88 ms, Td - 25.56 ± 3.58 and 25.44 ± 3.20 ms, and Dm - 7.39 ± 1.87 and 7.52 ± 2.50 mm, for the dominant and non-dominant leg, respectively. The results have indicated that there was no statistically significant difference between the examined TMG variables of the dominant and non-dominant leg (Wilks' lambda Value = 0.979, F=0.300, p=0.952, Part. Ƞ² = 0.021). It may be stated that there are no differences in the manifestation of neuromuscular characteristics in healthy elite football players regardless of their dominant leg. A high level of preparedness in football in addition to a completely healthy status of the body and locomotor system result in a complete neuromuscular contractile symmetry BF of both legs. ABSTRACT FROM AUTHOR","2019","2020-05-20 00:32:52","2020-05-20 00:32:52",NA,"167-179",NA,"2","17",NA,NA,NA,NA,NA,NA,NA,NA,NA,"",NA,NA,NA,NA,"sph",NA,NA,NA,"","https://gateway.library.qut.edu.au/login?url=https://search.ebscohost.com/login.aspx?direct=true&db=sph&AN=140495832&site=ehost-live&scope=site","*SOCCER players; Football; *BODY mass index; *STATURE; *BICEPS femoris; Biceps Femoris; DIMORPHISM (Biology); Dominant leg; dominantna noga; fudbal; mišić; Muscle; Tensiomyography; tenziomiografija",NA,NA,NA,NA,NA,NA,NA,NA,NA,NA,NA,NA,NA,NA,NA,NA,NA,NA,NA,NA,NA,NA,NA,NA,NA,NA,NA,NA,NA,NA,NA,NA,NA,NA,NA,NA,NA,NA,NA,NA,NA,NA,NA,NA,NA,NA,NA,0
"37","H5LYLZM3","journalArticle",2019,"Barth, K. A.; Lawton, C. D.; Touhey, D. C.; Selley, R. S.; Li, D. D.; Balderama, E. S.; Nuber, G. W.; Hsu, W. K.","The negative impact of anterior cruciate ligament reconstruction in professional male footballers","Knee",NA,"1873-5800 0968-0160","10.1016/j.knee.2018.10.004",NA,"Background: Soccer is one of the most common international sports in which ACL injuries occur, with previous studies reporting high return-to-play rates following ACL reconstruction (ACLR). Return-to-play analysis fails to take into consideration how effective a player remains once returning to competition. The aims of this study are to provide a large-scale international analysis of return-to-play and player performance statistics among professional soccer athletes following ACLR. Methods: Using publicly available sources, professional soccer athletes who have undergone ACLR between the 1996 and 2015 seasons were identified. Player metrics including statistical performance, recovery time, and return-to-play rates were analyzed both before and after reconstruction. Furthermore, player performance statistics during each of three consecutive seasons post-ACLR were compared. Results: A total of 176 athletes who underwent ACLR were included in this study. The return-to-play rate was 93.2% (164 athletes). Cumulative post-surgical statistical analysis of ACLR players demonstrated fewer games/season, minutes/season, minutes/game, goals/season, and more fouls/season following ACLR (p < 0.04). Analysis of player performance statistics suggests that athletes do not return to their baseline number of games/season and minutes/game until two and three seasons post-ACLR, respectively. At three seasons post-ACLR, athletes are still starting fewer games/season and scoring fewer goals/90 min (p < 0.04). Conclusion: Return-to-play rate is high following ACLR; however, athletes exhibit poorer statistical performance, especially in the first few seasons upon return. Our data shows that athletes continue to start fewer games/season and score fewer goals/90 min at three seasons post-ACLR.","2019","2020-05-20 00:32:41","2020-05-20 00:32:41",NA,"142-148",NA,"1","26",NA,NA,NA,NA,NA,NA,NA,NA,NA,"English",NA,NA,NA,NA,"Embase Medline",NA,NA,NA,"; ","http://dx.doi.org/10.1016/j.knee.2018.10.004; http://www.embase.com/search/results?subaction=viewrecord&from=export&id=L2001286900","adult; football player; human; male; article; soccer; case report; clinical article; season; anterior cruciate ligament reconstruction; statistics; surgery; statistical analysis",NA,NA,NA,NA,NA,NA,NA,NA,NA,NA,NA,NA,NA,NA,NA,NA,NA,NA,NA,NA,NA,NA,NA,NA,NA,NA,NA,NA,NA,NA,NA,NA,NA,NA,NA,NA,NA,NA,NA,NA,NA,NA,NA,NA,NA,NA,NA,0
