"20","8WXCZXEV","journalArticle",2019,"Morris, T. P.; McCracken, C.; Baggish, A.; Weisskopf, M.; Zafonte, R.; Taylor, H. A.; Nadler, L. M.; Speizer, F. E.; Pascual-Leone, A.","Multisystem afflictions in former National Football League players","American journal of industrial medicine",NA,"1097-0274","10.1002/ajim.22992",NA,"BACKGROUND: The long-term health consequences of participation in American style football (ASF) are not well understood. METHODS: We conducted a retrospective cohort study of men who had played in the NFL after 1960. Participants were studied using a standardized self-administered questionnaire designed to determine both the exposure history to ASF and the prevalence of chronic pain, sleep apnea, cardiometabolic disease, and neurocognitive impairment. Logistic regression and negative binomial regression models were used to assess associations between age, ethnicity, body-mass index during professional football career, field position, and football career duration with individual and multiple afflictions. RESULTS: In this cohort of former NFL players (n = 3745), approximately one quarter of the eligible former players (27%) reported two or more medical afflictions (chronic pain, cardiometabolic disease, sleep apnea, or neurocognitive impairment). Career duration was significantly associated with an increase in the number of comorbidities. Age, race, and body-mass index were associated with all affliction categories, other than neurocognitive impairment, which was similarly prevalent in middle-aged players and older players. Earlier age when first playing the sport was protective against cardiometabolic affliction. CONCLUSIONS: Former NFL players report significant combinations of cross-system afflictions. Future work will be required to determine mechanistic underpinnings. However, attention to the whole player, rather than specific organ systems seems critical to improve long-term health outcomes in former ASF professional athletes.","2019","2020-05-20 00:32:13","2020-05-20 00:32:13",NA,"655-662",NA,"8","62",NA,NA,NA,NA,NA,NA,NA,NA,NA,"English",NA,NA,NA,NA,"Medline",NA,NA,NA,"; ","http://dx.doi.org/10.1002/ajim.22992; http://www.embase.com/search/results?subaction=viewrecord&from=export&id=L628053276","adult; human; male; article; football; controlled study; major clinical study; athlete; body mass; cohort analysis; ethnicity; race; questionnaire; retrospective study; attention; prevalence; career; middle aged; comorbidity; aging; sleep disordered breathing; chronic pain; organ systems",NA,NA,NA,NA,NA,NA,NA,NA,NA,NA,NA,NA,NA,NA,NA,NA,NA,NA,NA,NA,NA,NA,NA,NA,NA,NA,NA,NA,NA,NA,NA,NA,NA,NA,NA,NA,NA,NA,NA,NA,NA,NA,NA,NA,NA,NA,NA,0
"21","EMINJTSZ","journalArticle",2019,"Black, Georgia M.; Gabbett, Tim J.; Johnston, Rich D.; Cole, Michael H.; Naughton, Geraldine; Dawson, Brian","A skill profile of the national women's Australian football league (AFLW)","Science & Medicine in Football",NA,"24734446","",NA,"Objectives: To investigate the relationship between technical involvements and (1) winning margins, (2) losing margins and (3) ladder position in the national Australian Football League Women's competition (AFLW). Methods: The first season of AFLW technical data were analysed. All matches (n = 26) were separated into winning and losing subsets and score margins were recorded. To investigate the influence of technical involvements on overall performance, final ladder position was also recorded. Results: Uncontested possessions and the ratio between the number of times the ball was inside the attacking 50-m zone (inside 50s) and goals scored, were identified as the biggest predictors of match outcomes in the AFLW. Larger winning margins were associated with reduced marks ""inside 50"" and a lower inside 50: goals scored ratio. Kicks and contested marks demonstrated significant relationships with final ladder position, with these involvements decreasing as the ladder position moved closer to eight. Conclusions: Team game plans should promote the importance of finding space and completing a number of passes in the attacking 50-m zone to allow closer shots on goal. Further to this, coaches may need to draft players who are able to ""win"" marking contests to improve ladder position in the future seasons.. ABSTRACT FROM AUTHOR","2019","2020-05-20 00:44:27","2020-05-20 00:44:27",NA,"138-142",NA,"2","3",NA,NA,NA,NA,NA,NA,NA,NA,NA,"",NA,NA,NA,NA,"sph",NA,NA,NA,"","https://gateway.library.qut.edu.au/login?url=https://search.ebscohost.com/login.aspx?direct=true&db=sph&AN=136271109&site=ehost-live&scope=site","team sports; ladder position; match result; Technical involvements",NA,NA,NA,NA,NA,NA,NA,NA,NA,NA,NA,NA,NA,NA,NA,NA,NA,NA,NA,NA,NA,NA,NA,NA,NA,NA,NA,NA,NA,NA,NA,NA,NA,NA,NA,NA,NA,NA,NA,NA,NA,NA,NA,NA,NA,NA,NA,0
"22","NE2RYAXW","journalArticle",2019,"de Freitas, Victor Hugo; Rinaldo, Márcio; Guimarães Turquino, Guilherme; Miloski, Bernardo; de Paula Ramos, Solange","Training aimed at the development of power and physical performance of futsal players","Brazilian Journal of Kineanthropometry & Human Performance",NA,"1415-8426","10.1590/1980-0037.2019v21e60119",NA,"The aim of the study was to analyze the effect of a training period aimed at the development of lower limb power and physical performance of futsal players. The sample consisted of 10 futsal players from a professional team aged 23.70 ± 5.85 years, 72.33 ± 6.01 kg and 174.40 ± 0.05 cm. Players were monitored for a period of 4 training weeks, corresponding to the beginning of the competitive period. During this period, physical training sought to improve lower limb power. At the beginning and end of the training period, the following tests were performed: Squat jump (SJ), Countermovement jump (CMJ), 15-meter speed (Vel_15m) and Futsal Intermittent Endurance Test (FIET). The training load was monitored by the Session Perceived Exertion method. Weeks 1 and 3 presented higher training load than weeks 2 and 4 (p <0.01). In the post-training period, shorter running time in the Vel_15m test (p = 0.04), greater height in SJ (p <0.01) and CMJ (p <0.01) tests, and higher maximal speed in FIET (p = 0.04) were observed. It could be concluded that directing training at the beginning of the competitive season to improve power increases the lower limb power of futsal players, with consequent improvement of speed and the ability to perform intermittent actions at high intensities. O objetivo do estudo foi analisar o efeito de um período de treinamento direcionado ao desenvolvimento de potência de membros inferiores no desempenho físico de jogadores de futsal. A amostra foi composta por 10 jogadores de futsal de uma equipe profissional com 23,70 ± 5,85 anos, 72,33 ± 6,01 kg e 174,40 ± 0,05 cm. Os jogadores foram monitorados por um período de 4 semanas de treinamento, correspondente ao início do período competitivo. Neste período, o treinamento físico buscou aperfeiçoar a potência de membros inferiores. No início e ao término do período, foram realizados os testes: Squat jump (SJ), Countermovemt jump (CMJ), velocidade de 15 metros (Vel&lowbar;15m) e Futsal Intermitente Endurance Test (FIET). A carga de treinamento foi monitorada pelo método da percepção subjetiva de esforço da sessão. As semanas 1 e 3 apresentaram maior CTST que as semanas 2 e 4 (p < 0,01). No momento pós treinamento, observou-se menor tempo de corrida no teste de Vel&lowbar;15m (p = 0,04), maior altura nos testes SJ (p < 0,01) e CMJ (p < 0,01), e maior velocidade no FIET (p = 0,04). Pode-se concluir que direcionar o treinamento no início da temporada competitiva para melhora da potência proporciona incremento na potência de membros inferiores de jogadores de futsal, com consequente melhora da velocidade e na capacidade de realizar ações intermitentes em alta intensidade.","2019","2020-05-20 00:53:24","2020-05-20 00:53:24",NA,"1-10",NA,"","21",NA,NA,NA,NA,NA,NA,NA,NA,NA,"",NA,NA,NA,NA,"c8h",NA,NA,NA,"","https://gateway.library.qut.edu.au/login?url=https://search.ebscohost.com/login.aspx?direct=true&db=c8h&AN=141528649&site=ehost-live&scope=site","Adult; Soccer; Athletes, Professional; Human; Athletic Performance; Adolescence; Training Effect (Physiology); Professional Sports; Athletic Training; Time Factors; Sporting Events; Physical Performance; Muscle Strength -- Evaluation; Aptitude Tests; Athletic Ability -- Evaluation; Exertion -- Evaluation; Jumping -- Evaluation; Lower Extremity -- Physiology; Physical Endurance -- Evaluation; Running -- Evaluation; Squatting -- Evaluation",NA,NA,NA,NA,NA,NA,NA,NA,NA,NA,NA,NA,NA,NA,NA,NA,NA,NA,NA,NA,NA,NA,NA,NA,NA,NA,NA,NA,NA,NA,NA,NA,NA,NA,NA,NA,NA,NA,NA,NA,NA,NA,NA,NA,NA,NA,NA,0
"23","K3J6BLHE","journalArticle",2019,"Koçak, Umut Ziya; Ünver, Bayram","Investigation of the Relationship Between Functional Movement Screen and Y Balance Test in Female Soccer Players as Injury Risk Predictors. / Kadın Futbolcularda Yaralanma Riski Belirleyicileri Olarak Fonksiyonel Hareket Analizi ve Y Denge Testi Arasındaki İlişkinin İncelenmesi","Spor Hekimligi Dergisi/Turkish Journal of Sports Medicine",NA,"13000551","",NA,"Objective: Functional Movement Screen (FMS) and Y Balance Test (YBT) have been used in recent years as injury risk predictors for many sports. While FMS provides information about core stability, movement patterns and dynamic balance, YBT is used only for evaluating dynamic balance. The purpose of this study was to investigate the relationships between the results obtained from FMS and YBT evaluations in female soccer players. Material and Methods: Twenty-four female soccer players aged between 17-30 years were evaluated by an experienced physiotherapist in terms of FMS and YBT. Each movement was scored between 0 (not able to perform) and 3 (performed correctly) in FMS, which includes seven different movement tests. The YBT scores was obtained by using the standardized formula of the values obtained after measurements which were performed in three different directions with the help of an equipment. Results: The mean age was 21.1±4.0 years, mean FMS result was 16.6±1.6, mean right-side YBT results was 96.4±4.9%, mean left-side YBT was 96.3±4.1%. Using Spearman's correlation analysis, significant and moderate correlations were found between FMS results and right YBT results (rho:0.495; p:0.014), and FMS results and left YBT results (rho:0.512; p:0.011). Conclusions: According to our results, FMS and YBT scores, which are used as determinants of injury risk, are moderately related to each other in female soccer players. Thus, we believe, using FMS which includes more comprehensive evaluations might provide more detailed results about injury prediction for professionals who work in sports field. ABSTRACT FROM AUTHOR","2019","2020-05-20 00:28:13","2020-05-20 00:28:13",NA,"1-8",NA,"1","54",NA,NA,NA,NA,NA,NA,NA,NA,NA,"",NA,NA,NA,NA,"sph",NA,NA,NA,"","https://gateway.library.qut.edu.au/login?url=https://search.ebscohost.com/login.aspx?direct=true&db=sph&AN=135396124&site=ehost-live&scope=site","athletic injuries; Female soccer player; injury risk analysis; Kadın futbolcu; postural balance; postüral denge; spor yaralanması; yaralanma risk analizi",NA,NA,NA,NA,NA,NA,NA,NA,NA,NA,NA,NA,NA,NA,NA,NA,NA,NA,NA,NA,NA,NA,NA,NA,NA,NA,NA,NA,NA,NA,NA,NA,NA,NA,NA,NA,NA,NA,NA,NA,NA,NA,NA,NA,NA,NA,NA,0
"24","S8RGFPUN","journalArticle",2019,"Lundgårdh, F.; Svensson, K.; Alricsson, M.","Epidemiology of hip and groin injuries in Swedish male first football league","Knee surgery, sports traumatology, arthroscopy : official journal of the ESSKA",NA,"1433-7347","10.1007/s00167-019-05470-x",NA,"PURPOSE: This study aimed to investigate the incidence, pattern, and burden of hip/groin injuries in Swedish professional male football players over five consecutive seasons. METHODS: Injury history from 16 football teams in the Swedish male first football league was evaluated during five consecutive seasons. The team's medical staff recorded team exposure and time-loss injuries prospectively between 2012 and 2016. RESULTS: In total, 467 time-loss injuries located in the hip/groin area were recorded among 1,687 professional male football players, with an overall incidence and burden of 0.82/1,000 h and 15.6/1,000 h, respectively. There appeared to be an increased risk of hip/groin injuries during the last two seasons (2015-2016); however, the difference was not statistically significant (n.s). Recurrent injury rate was relatively low (14%), and overuse injuries accounted for the majority of injuries and absence days. Muscle injuries were the main injury type, while kicking and sprinting/running were the primary causes of injury. Goalkeepers had the lowest percentage of injuries and absence days. CONCLUSION: Hip/groin injuries are a substantial problem in football, but does not seem to be an increasing phenomenon in the Swedish male first football league. Index and overuse injuries accounted for the majority of injuries and absence days. Thus, the focus should be on preventing hip/groin injuries to lower the injury rate. These new findings should be taken into consideration when designing and implementing preventive training interventions.II.","2019","2020-05-20 00:20:13","2020-05-20 00:20:13",NA,"",NA,"","",NA,NA,NA,NA,NA,NA,NA,NA,NA,"English",NA,NA,NA,NA,"Medline",NA,NA,NA,"; ","http://www.embase.com/search/results?subaction=viewrecord&from=export&id=L626970624; http://dx.doi.org/10.1007/s00167-019-05470-x","adult; football player; human; male; article; soccer; hip; clinical article; controlled study; incidence; season; running; medical staff; inguinal region; risk factor; muscle injury; cumulative trauma disorder; prevention; Swedish citizen",NA,NA,NA,NA,NA,NA,NA,NA,NA,NA,NA,NA,NA,NA,NA,NA,NA,NA,NA,NA,NA,NA,NA,NA,NA,NA,NA,NA,NA,NA,NA,NA,NA,NA,NA,NA,NA,NA,NA,NA,NA,NA,NA,NA,NA,NA,NA,0
"25","HVSDICVQ","journalArticle",2019,"Gonçalves, B.; Coutinho, D.; Exel, J.; Travassos, B.; Lago, C.; Sampaio, J.","Extracting spatial-temporal features that describe a team match demands when considering the effects of the quality of opposition in elite football","PLoS ONE",NA,"1932-6203","10.1371/journal.pone.0221368",NA,"Spatiotemporal patterns of play can be extracted from competitive environments to design representative training tasks and underlying processes that sustain performance outcomes. To support this statement, the aims of this study were: (i) describe the collective behavioural patterns that relies upon the use of player positioning in interaction with teammates, opponents and ball positioning; (ii) and define the underlying structure among the variables through application of a factorial analysis. The sample comprised a total of 1,413 ball possession sequences, obtained from twelve elite football matches from one team (the team ended the season in the top-5 position). The dynamic position of the players (from both competing teams), as well as the ball, were captured and transformed to two-dimensional coordinates. Data included the ball possession sequences from six matches played against top opponents (TOP, the three teams classified in the first 3 places at the end of the season) and six matches against bottom opponents (BOTTOM, the three teams classified in the last 3 at the end of the season). The variables calculated for each ball possession were the following: ball position; team space in possession; game space (comprising the outfield players of both teams); position and space at the end of ball possession. Statistical comparisons were carried with magnitude-based decisions and null-hypothesis analysis and factor analysis to define the underlying structure among variables according to the considered contexts. Results showed that playing against TOP opponents, there was ~38 meters game length per ~43 meters game width with 12% of coefficient of variation (%). Ball possessions lasted for ~28 seconds and tended to end at ~83m of pitch length. Against BOTTOM opponents, a decrease in the game length with an increase in game width and in the deepest location was observed in comparison with playing against TOP opponents. The duration of ball possession increased considerable (~37 seconds), and the ball speed entropy was higher, suggesting lower levels of regularity in comparison with TOP opponents. The BOTTOM teams revealed a small EPS. The Principal Component Analysis showed a strong association of the ball speed, entropy of the ball speed and the coefficient of variation (%) of the ball speed. The EPS of the team in possession was well correlated with the game space, especially the game width facing TOP opponents. Against BOTTOM opponents, there was a strong association of ball possession duration, game width, distance covered by the ball, and length/width ratio of the ball movement. The overall approach carried out in this study may serve as the starting point to elaborate normative models of positioning behaviours measures to support the coaches’ operating decisions.","2019","2020-05-20 00:21:59","2020-05-20 00:21:59",NA,"",NA,"8","14",NA,NA,NA,NA,NA,NA,NA,NA,NA,"English",NA,NA,NA,NA,"Embase Medline",NA,NA,NA,"; ","http://dx.doi.org/10.1371/journal.pone.0221368; http://www.embase.com/search/results?subaction=viewrecord&from=export&id=L2002677579","human; article; football; season; velocity; pitch; principal component analysis; factor analysis; entropy; null hypothesis",NA,NA,NA,NA,NA,NA,NA,NA,NA,NA,NA,NA,NA,NA,NA,NA,NA,NA,NA,NA,NA,NA,NA,NA,NA,NA,NA,NA,NA,NA,NA,NA,NA,NA,NA,NA,NA,NA,NA,NA,NA,NA,NA,NA,NA,NA,NA,0
"26","PPNQ9W8H","journalArticle",2019,"Vora, D.; Baker, M.; Pandarinath, R.","Impact of Clavicle Fractures on Return to Play and Performance Ratings in NFL Athletes","Clinical journal of sport medicine : official journal of the Canadian Academy of Sport Medicine",NA,"1536-3724","10.1097/JSM.0000000000000548",NA,"OBJECTIVE: Clavicle fractures in the National Football League (NFL) have gained significant attention because of their impact on high profile athletes; however, little has been published on the overall impact of these injuries. This study sought to determine the time to return to play and quantitative impact on athletic performance after clavicle fractures in NFL athletes. DESIGN: Retrospective Cohort Study; Level of evidence, 3. SETTING: Retrospective cohort study of NFL athletes based on published injury reports and player statistics. PARTICIPANTS: This study consisted of 17 NFL athletes who sustained a clavicle fracture from 1998 to 2015 and returned to the field after the injury during the study period. Three athletes were excluded from performance analysis because of not playing for the entire season after injury. Control groups consisted of position-matched NFL athletes who competed in the 2013 NFL season without an identified clavicle injury. MAIN OUTCOME MEASURES: Median time to return to play after a clavicle fracture and the impact on player performance rating. RESULTS: Athletes returned to the competition after a median of 3.47 months after injury and missed a median of 8 games. There was no statistically significant impact on athletic performance after returning to play. CONCLUSION: Although clavicle fractures did have a significant impact on athletes because of lost playing time, there was no statistically significant difference in player performance after the injury when compared with a control group.","2019","2020-05-20 00:25:37","2020-05-20 00:25:37",NA,"459-464",NA,"6","29",NA,NA,NA,NA,NA,NA,NA,NA,NA,"English",NA,NA,NA,NA,"Medline",NA,NA,NA,"; ","http://dx.doi.org/10.1097/JSM.0000000000000548; http://www.embase.com/search/results?subaction=viewrecord&from=export&id=L629766639","human; male; football; injury; return to sport; retrospective study; athletic performance; fracture; United States; time factor; clavicle",NA,NA,NA,NA,NA,NA,NA,NA,NA,NA,NA,NA,NA,NA,NA,NA,NA,NA,NA,NA,NA,NA,NA,NA,NA,NA,NA,NA,NA,NA,NA,NA,NA,NA,NA,NA,NA,NA,NA,NA,NA,NA,NA,NA,NA,NA,NA,0
"27","STVRHUEU","journalArticle",2019,"Anderson, L.; Close, G. L.; Konopinski, M.; Rydings, D.; Milsom, J.; Hambly, C.; Speakman, J. R.; Drust, B.; Morton, J. P.","Case study: Muscle atrophy, hypertrophy, and energy expenditure of a premier league soccer player during rehabilitation from anterior cruciate ligament injury","International Journal of Sport Nutrition and Exercise Metabolism",NA,"1543-2742 1526-484X","10.1123/ijsnem.2018-0391",NA,"Maintaining muscle mass and function during rehabilitation from anterior cruciate ligament injury is complicated by the challenge of accurately prescribing daily energy intakes aligned to energy expenditure. Accordingly, we present a 38-week case study characterizing whole body and regional rates of muscle atrophy and hypertrophy (as inferred by assessments of fat-free mass from dual-energy X-ray absorptiometry) in a professional male soccer player from the English Premier League. In addition, inWeek 6, we also quantified energy intake (via the remote food photographic method) and energy expenditure using the doubly labeled water method.Mean daily energy intake (CHO: 1.9-3.2, protein: 1.7-3.3, and fat: 1.4-2.7 g/kg) and energy expenditure were 2,765 ± 474 and 3,178 kcal/day, respectively. In accordance with an apparent energy deficit, total body mass decreased by 1.9 kg duringWeeks 1-6 where fat-free mass loss in the injured and noninjured limb was 0.9 and 0.6 kg, respectively, yet, trunk fat-free mass increased by 0.7 kg. In Weeks 7-28, the athlete was advised to increase daily CHO intake (4-6 g/kg) to facilitate an increased daily energy intake. Throughout this period, total bodymass increased by 3.6 kg (attributable to a 2.9 and 0.7 kg increase in fat free and fat mass, respectively). Our data suggest it may be advantageous to avoid excessive reductions in energy intake during the initial 6-8 weeks post anterior cruciate ligament surgery so as to limit muscle atrophy.","2019","2020-05-20 00:10:10","2020-05-20 00:10:10",NA,"559-566",NA,"5","29",NA,NA,NA,NA,NA,NA,NA,NA,NA,"English",NA,NA,NA,NA,"Embase Medline",NA,NA,NA,"; ","http://dx.doi.org/10.1123/ijsnem.2018-0391; http://www.embase.com/search/results?subaction=viewrecord&from=export&id=L2004195356","adult; human; male; article; soccer player; case report; clinical article; body mass; food intake; resistance training; anterior cruciate ligament injury; knee meniscus rupture; professional athlete; anthropometry; muscle injury; caloric intake; energy expenditure; dual energy X ray absorptiometry; fat free mass; doubly labeled water technique; ligament surgery; muscle atrophy; muscle hypertrophy; rehabilitation care",NA,NA,NA,NA,NA,NA,NA,NA,NA,NA,NA,NA,NA,NA,NA,NA,NA,NA,NA,NA,NA,NA,NA,NA,NA,NA,NA,NA,NA,NA,NA,NA,NA,NA,NA,NA,NA,NA,NA,NA,NA,NA,NA,NA,NA,NA,NA,0
"28","GCRY8TBU","journalArticle",2019,"Hölzen, Martin; Meier, Henk Erik","Do Football Consumers Care About Sport Governance? An Analysis of Social Media Responses to the Recent FIFA Scandal","Journal of Global Sport Management",NA,"24704067","",NA,"Given the fact that the governing body of world football, FIFA, has managed to survive major failures in sports governance, this paper addresses the role of football consumers as potential principals. By characterizing FIFA as a 'political machine' and using 'digital trace data' from Twitter to analyze responses to the most recent FIFA corruption scandal, this paper introduces a new methodological approach to the realm of research on sports governance. Key events of FIFA's corruption scandal trigger significant activities, but the attention is ephemeral as it decreases over time. In addition, there is little evidence that the corruption scandal has a detrimental effect on FIFA's legitimacy among users. Ultimately, online activism striving to change FIFA's governance seems to have only rudimentarily developed and is sparsely popular among individual football fans. The paper casts further doubts on the ability of football consumers to act as effective principals in football governance. ABSTRACT FROM AUTHOR","2019","2020-05-20 00:14:49","2020-05-20 00:14:49",NA,"97-120",NA,"1","4",NA,NA,NA,NA,NA,NA,NA,NA,NA,"",NA,NA,NA,NA,"sph",NA,NA,NA,"","https://gateway.library.qut.edu.au/login?url=https://search.ebscohost.com/login.aspx?direct=true&db=sph&AN=134940420&site=ehost-live&scope=site","*FOOTBALL; FEDERATION internationale de football association; CORRUPTION; digital trace data; FIFA corruption scandal; political machine; POLITICAL machines; Sport governance; twitter; TWITTER (Web resource); 体育管理; 国际足联腐败丑闻; 推特; 政治机器; 数字追踪数据",NA,NA,NA,NA,NA,NA,NA,NA,NA,NA,NA,NA,NA,NA,NA,NA,NA,NA,NA,NA,NA,NA,NA,NA,NA,NA,NA,NA,NA,NA,NA,NA,NA,NA,NA,NA,NA,NA,NA,NA,NA,NA,NA,NA,NA,NA,NA,0
